{
  "schemaVersion": "1.0.0",
  "name": "specbridge-examples",
  "updatedAt": "2026-01-01T00:00:00.000Z",
  "extensions": [
    {
      "id": "example-analyzer",
      "displayName": "example-analyzer",
      "description": "Deterministic spec diagnostics contributed by the example-analyzer analyzer extension.",
      "kind": "analyzer",
      "latestVersion": "1.0.0",
      "versions": [
        {
          "version": "1.0.0",
          "archiveUrl": "https://example.invalid/specbridge-extensions/example-analyzer-1.0.0.specbridge-extension.zip",
          "sha256": "4d2ed293339ac609b5a0db4e6810c4a621541e3c2c0fa850693831ea196f71d9",
          "manifest": {
            "protocolVersion": "1.0.0",
            "compatibility": {
              "specbridge": ">=0.7.1 <1.0.0"
            },
            "permissions": {
              "specRead": true,
              "repositoryRead": false,
              "repositoryWrite": false,
              "network": false,
              "childProcess": false,
              "environmentVariables": []
            }
          }
        }
      ],
      "repository": "https://github.com/HelloThisWorld/specbridge",
      "license": "MIT",
      "keywords": [
        "analyzer",
        "specbridge-extension"
      ]
    },
    {
      "id": "example-exporter",
      "displayName": "example-exporter",
      "description": "Candidate export files produced by the example-exporter exporter extension.",
      "kind": "exporter",
      "latestVersion": "1.0.0",
      "versions": [
        {
          "version": "1.0.0",
          "archiveUrl": "https://example.invalid/specbridge-extensions/example-exporter-1.0.0.specbridge-extension.zip",
          "sha256": "0bc6c8097275c27df59695bf88f279d5c6ff0a29511673ad00f7df33c4f85228",
          "manifest": {
            "protocolVersion": "1.0.0",
            "compatibility": {
              "specbridge": ">=0.7.1 <1.0.0"
            },
            "permissions": {
              "specRead": true,
              "repositoryRead": false,
              "repositoryWrite": false,
              "network": false,
              "childProcess": false,
              "environmentVariables": []
            }
          }
        }
      ],
      "repository": "https://github.com/HelloThisWorld/specbridge",
      "license": "MIT",
      "keywords": [
        "exporter",
        "specbridge-extension"
      ]
    },
    {
      "id": "example-runner",
      "displayName": "example-runner",
      "description": "An out-of-process runner adapter provided by the example-runner extension.",
      "kind": "runner",
      "latestVersion": "1.0.0",
      "versions": [
        {
          "version": "1.0.0",
          "archiveUrl": "https://example.invalid/specbridge-extensions/example-runner-1.0.0.specbridge-extension.zip",
          "sha256": "9b5d29c5281cfd062cc506db8dbd2baaf6192221a7da782036f0eb5ceda8ef50",
          "manifest": {
            "protocolVersion": "1.0.0",
            "compatibility": {
              "specbridge": ">=0.7.1 <1.0.0"
            },
            "permissions": {
              "specRead": true,
              "repositoryRead": true,
              "repositoryWrite": true,
              "network": false,
              "childProcess": false,
              "environmentVariables": []
            }
          }
        }
      ],
      "repository": "https://github.com/HelloThisWorld/specbridge",
      "license": "MIT",
      "keywords": [
        "runner",
        "specbridge-extension"
      ]
    },
    {
      "id": "example-template-provider",
      "displayName": "example-template-provider",
      "description": "Spec template packs contributed by the example-template-provider template-provider extension.",
      "kind": "template-provider",
      "latestVersion": "1.0.0",
      "versions": [
        {
          "version": "1.0.0",
          "archiveUrl": "https://example.invalid/specbridge-extensions/example-template-provider-1.0.0.specbridge-extension.zip",
          "sha256": "83572ecc9cc5a40451a4ecd7ea8c1ab3171e022ca5442566f110ef1de71d8533",
          "manifest": {
            "protocolVersion": "1.0.0",
            "compatibility": {
              "specbridge": ">=0.7.1 <1.0.0"
            },
            "permissions": {
              "specRead": false,
              "repositoryRead": false,
              "repositoryWrite": false,
              "network": false,
              "childProcess": false,
              "environmentVariables": []
            }
          }
        }
      ],
      "repository": "https://github.com/HelloThisWorld/specbridge",
      "license": "MIT",
      "keywords": [
        "template-provider",
        "specbridge-extension"
      ]
    },
    {
      "id": "example-verifier",
      "displayName": "example-verifier",
      "description": "Verification diagnostics contributed by the example-verifier verifier extension.",
      "kind": "verifier",
      "latestVersion": "1.0.0",
      "versions": [
        {
          "version": "1.0.0",
          "archiveUrl": "https://example.invalid/specbridge-extensions/example-verifier-1.0.0.specbridge-extension.zip",
          "sha256": "17e78d12a74b2944983a38527e8568117d56ed53e219a5a976787bb1bed832af",
          "manifest": {
            "protocolVersion": "1.0.0",
            "compatibility": {
              "specbridge": ">=0.7.1 <1.0.0"
            },
            "permissions": {
              "specRead": true,
              "repositoryRead": false,
              "repositoryWrite": false,
              "network": false,
              "childProcess": false,
              "environmentVariables": []
            }
          }
        }
      ],
      "repository": "https://github.com/HelloThisWorld/specbridge",
      "license": "MIT",
      "keywords": [
        "verifier",
        "specbridge-extension"
      ]
    }
  ]
}
